{
  "$schema": "../scorecard.schema.json",
  "widgetType": "soundboard",
  "rubricVersion": "1.1.0",
  "gradedAt": "2026-10-26T13:21:09.909Z",
  "stale": false,
  "criteria": {
    "S6": {
      "score": null,
      "source": "script",
      "note": "N/A by rule",
      "rubricVersion": "1.1.0",
      "gradedAt": "2026-10-18T15:26:01.461Z",
      "stale": false
    },
    "I5": {
      "score": null,
      "source": "script",
      "note": "N/A by rule",
      "rubricVersion": "1.1.0",
      "gradedAt": "2026-10-18T15:26:01.461Z",
      "stale": false
    },
    "S1": {
      "score": 1,
      "source": "judge",
      "candidates": {
        "script": null,
        "judge": 1
      },
      "evidence": {
        "screenshots": [
          "scripts/widget-grader/out/soundboard-after1/screenshots/soundboard/envelope-min__empty.png",
          "scripts/widget-grader/out/soundboard-after1/screenshots/soundboard/envelope-min__typical.png",
          "scripts/widget-grader/out/soundboard-after1/screenshots/soundboard/envelope-min__stress.png"
        ],
        "runId": "soundboard-after1"
      },
      "note": "At 150x100 the six typical tiles stay legible, but the stress fixture shrinks all 24 tiles uniformly to 2px labels and 22px targets instead of hiding or overflowing anything.",
      "rubricVersion": "1.1.0",
      "gradedAt": "2026-10-18T15:26:01.461Z",
      "stale": false
    },
    "S2": {
      "score": 2,
      "source": "judge",
      "candidates": {
        "script": null,
        "judge": 2
      },
      "evidence": {
        "screenshots": [
          "scripts/widget-grader/out/soundboard-after1/screenshots/soundboard/default__typical.png",
          "scripts/widget-grader/out/soundboard-after1/screenshots/soundboard/large-1400x900__typical.png",
          "scripts/widget-grader/out/soundboard-after1/screenshots/soundboard/large-1400x900__stress.png"
        ],
        "runId": "soundboard-after1"
      },
      "note": "At 1400x900 the tiles stretch to fill the card but the speaker icon and label barely grow (1.22x), leaving small content floating in huge colored blocks.",
      "rubricVersion": "1.1.0",
      "gradedAt": "2026-10-18T15:26:01.461Z",
      "stale": false
    },
    "S3": {
      "score": 3,
      "source": "judge",
      "candidates": {
        "script": null,
        "judge": 3
      },
      "evidence": {
        "screenshots": [
          "scripts/widget-grader/out/soundboard-after1/screenshots/soundboard/widest-aspect__typical.png",
          "scripts/widget-grader/out/soundboard-after1/screenshots/soundboard/widest-aspect__stress.png",
          "scripts/widget-grader/out/soundboard-after1/screenshots/soundboard/tallest-aspect__typical.png",
          "scripts/widget-grader/out/soundboard-after1/screenshots/soundboard/tallest-aspect__stress.png"
        ],
        "runId": "soundboard-after1"
      },
      "note": "The grid reflows to a single row of six at the widest aspect and a single column (three columns under stress) at the tallest, with about 7% dead area.",
      "rubricVersion": "1.1.0",
      "gradedAt": "2026-10-18T15:26:01.461Z",
      "stale": false
    },
    "S4": {
      "score": 2,
      "source": "script",
      "candidates": {
        "script": 2
      },
      "evidence": {
        "screenshots": [
          "scripts/widget-grader/out/soundboard-after1/screenshots/soundboard/default__typical.png"
        ],
        "runId": "soundboard-after1"
      },
      "rubricVersion": "1.1.0",
      "gradedAt": "2026-10-18T15:26:01.461Z",
      "stale": false
    },
    "S5": {
      "score": 1,
      "source": "script",
      "candidates": {
        "script": 1
      },
      "evidence": {
        "screenshots": [
          "scripts/widget-grader/out/soundboard-after1/screenshots/soundboard/default__empty.png",
          "scripts/widget-grader/out/soundboard-after1/screenshots/soundboard/default__typical.png",
          "scripts/widget-grader/out/soundboard-after1/screenshots/soundboard/default__stress.png"
        ],
        "runId": "soundboard-after1"
      },
      "rubricVersion": "1.1.0",
      "gradedAt": "2026-10-18T15:26:01.461Z",
      "stale": false
    },
    "S7": {
      "score": 3,
      "source": "judge",
      "candidates": {
        "script": null,
        "judge": 3
      },
      "evidence": {
        "screenshots": [
          "scripts/widget-grader/out/soundboard-after1/screenshots/soundboard/envelope-min__typical.png",
          "scripts/widget-grader/out/soundboard-after1/screenshots/soundboard/default__typical.png"
        ],
        "runId": "soundboard-after1"
      },
      "note": "The global 150x100 floor still shows six tappable labeled tiles, which matches what a grid of sound buttons needs.",
      "rubricVersion": "1.1.0",
      "gradedAt": "2026-10-18T15:26:01.461Z",
      "stale": false
    },
    "S8": {
      "score": 2,
      "source": "paul",
      "candidates": {
        "script": null,
        "judge": 2,
        "paul": 2
      },
      "evidence": {
        "screenshots": [
          "scripts/widget-grader/out/spot-2026-10-26/screenshots/soundboard/maximized-1920x1080__empty.png",
          "scripts/widget-grader/out/spot-2026-10-26/screenshots/soundboard/maximized-1920x1080__typical.png",
          "scripts/widget-grader/out/spot-2026-10-26/screenshots/soundboard/maximized-1920x1080__stress.png"
        ],
        "runId": "spot-2026-10-26"
      },
      "rubricVersion": "1.1.0",
      "gradedAt": "2026-10-26T13:20:32.397Z",
      "stale": false
    },
    "I1": {
      "score": 1,
      "source": "script",
      "candidates": {
        "script": 1
      },
      "evidence": {
        "screenshots": [
          "scripts/widget-grader/out/soundboard-after1/screenshots/soundboard/default__typical.png"
        ],
        "runId": "soundboard-after1"
      },
      "rubricVersion": "1.1.0",
      "gradedAt": "2026-10-18T15:26:01.461Z",
      "stale": false
    },
    "I2": {
      "score": 2,
      "source": "script",
      "candidates": {
        "script": 2
      },
      "evidence": {
        "screenshots": [
          "scripts/widget-grader/out/soundboard-after1/screenshots/soundboard/default__typical.png"
        ],
        "runId": "soundboard-after1"
      },
      "rubricVersion": "1.1.0",
      "gradedAt": "2026-10-18T15:26:01.461Z",
      "stale": false
    },
    "I3": {
      "score": 3,
      "source": "script",
      "candidates": {
        "script": 3,
        "judge": 3
      },
      "evidence": {
        "screenshots": [
          "scripts/widget-grader/out/soundboard-after1/screenshots/soundboard/default__typical.png"
        ],
        "runId": "soundboard-after1"
      },
      "rubricVersion": "1.1.0",
      "gradedAt": "2026-10-18T15:26:01.461Z",
      "stale": false
    },
    "I4": {
      "score": 3,
      "source": "script",
      "candidates": {
        "script": 3
      },
      "evidence": {
        "screenshots": [
          "scripts/widget-grader/out/soundboard-after1/screenshots/soundboard/default__typical.png"
        ],
        "runId": "soundboard-after1"
      },
      "rubricVersion": "1.1.0",
      "gradedAt": "2026-10-18T15:26:01.461Z",
      "stale": false
    },
    "I6": {
      "score": 2,
      "source": "judge",
      "candidates": {
        "script": null,
        "judge": 2
      },
      "evidence": {
        "screenshots": [
          "scripts/widget-grader/out/soundboard-after1/screenshots/soundboard/default__typical.png"
        ],
        "runId": "soundboard-after1"
      },
      "note": "Tiles have hover brightness and active scale, but nothing on the face shows which sound is playing or lets you see it stop.",
      "rubricVersion": "1.1.0",
      "gradedAt": "2026-10-18T15:26:01.461Z",
      "stale": false
    },
    "I7": {
      "score": 3,
      "source": "script",
      "candidates": {
        "script": 3
      },
      "evidence": {
        "screenshots": [
          "scripts/widget-grader/out/soundboard-after1/screenshots/soundboard/envelope-min__typical__selected.png",
          "scripts/widget-grader/out/soundboard-after1/screenshots/soundboard/default__typical__selected.png",
          "scripts/widget-grader/out/soundboard-after1/screenshots/soundboard/large-1400x900__typical__selected.png",
          "scripts/widget-grader/out/soundboard-after1/screenshots/soundboard/widest-aspect__typical__selected.png",
          "scripts/widget-grader/out/soundboard-after1/screenshots/soundboard/tallest-aspect__typical__selected.png"
        ],
        "runId": "soundboard-after1"
      },
      "rubricVersion": "1.1.0",
      "gradedAt": "2026-10-18T15:26:01.461Z",
      "stale": false
    },
    "V1": {
      "score": 3,
      "source": "judge",
      "candidates": {
        "script": null,
        "judge": 3
      },
      "evidence": {
        "screenshots": [
          "scripts/widget-grader/out/soundboard-after1/screenshots/soundboard/default__typical.png"
        ],
        "runId": "soundboard-after1"
      },
      "note": "Flat rounded color tiles with one lucide icon style and bold labels look current, with only light text shadows and no ban-list hits on the typical face.",
      "rubricVersion": "1.1.0",
      "gradedAt": "2026-10-18T15:26:01.461Z",
      "stale": false
    },
    "V2": {
      "score": 3,
      "source": "judge",
      "candidates": {
        "script": null,
        "judge": 3
      },
      "evidence": {
        "screenshots": [
          "scripts/widget-grader/out/soundboard-after1/screenshots/soundboard/default__typical.png",
          "scripts/widget-grader/out/soundboard-after1/screenshots/soundboard/default__stress.png"
        ],
        "runId": "soundboard-after1"
      },
      "note": "The face is plainly a grid of labeled sound buttons at a glance, with just six tiles, two font sizes and six words.",
      "rubricVersion": "1.1.0",
      "gradedAt": "2026-10-18T15:26:01.461Z",
      "stale": false
    },
    "V3": {